<?xml version="1.0"?>
<Reservations xmlns:xsi="http://www.w3.org/2001/XMLSchema-instance" xsi:noNamespaceSchemaLocation="reservation.xsd">
    <Reservation offerId="1" courseId="1">
        <FirstName>Trevor</FirstName>
        <LastName>Smith</LastName>
        <Address>Road 66</Address>
        <City>Kentucky</City>
        <PLZ>1992</PLZ>
        <Mail>smithtrevor@gmail.com</Mail>
        <PhoneNumber>0791006564</PhoneNumber>
    </Reservation>
    <Reservation offerId="1" courseId="2">
        <FirstName>Mary</FirstName>
        <LastName>Jane</LastName>
        <Address>Carlin Street</Address>
        <City>Los Angeles</City>
        <PLZ>2002</PLZ>
        <Mail>mjane@gmail.com</Mail>
        <PhoneNumber>0112206633</PhoneNumber>
    </Reservation>
    <Reservation offerId="2" courseId="1">
        <FirstName>Bill</FirstName>
        <LastName>Borton</LastName>
        <Address>Westhaven Street</Address>
        <City>Los Angeles</City>
        <PLZ>1992</PLZ>
        <Mail>bborton@gmail.com</Mail>
        <PhoneNumber>1230004444</PhoneNumber>
    </Reservation>
</Reservations>
